{
  "sessionId": "c70867c0-3d9b-4cd4-978d-056a2915bb75",
  "magistrate": "Alan Smith",
  "courtHouseCode": "B01LY",
  "courtHouseName": "Coventry Magistrates' Court",
  "localJusticeAreaNationalCourtCode": "2924",
  "type": "MAGISTRATE",
  "legalAdviserUserId": "31ec3a16-8721-498c-8da5-f099390ee254"
}
